{
  "author_review_status": "AUTHOR_ONLY_AWAITING_INDEPENDENT_REVIEW",
  "blinded": true,
  "corpus_digest": "sha256:ab4057e2ef074608e43315054cc9c1e3a8d86320e686ff342c20de0cf905f27b",
  "corpus_id": "m1nd10-g6-held-out-v2-ab4057e2ef074608",
  "runner_contract": {
    "forbidden_artifact": "operator-only/corpus.json",
    "independent_review_status": "NOT_RUN",
    "labels_exposed": false,
    "read_only_artifact": "public/queries.json",
    "result_coverage": "emit exactly one measurement for every task_id",
    "source_checkout": "b59a1c2a1454a83164dfb4d5640c6b005154d1ee"
  },
  "schema": "m1nd10-g6-public-query-corpus-v2",
  "self_digest": "sha256:a40ebbff17f0dd219375f31f80e2a41b4cd02051dafa7302755035ffc38169c4",
  "source_manifest": {
    "manifest_digest": "sha256:a84e79c1c7553f1885dc726f66a32e11f35609d6da8cff5b197a2c459d5de15f",
    "repos": [
      {
        "file_set_digest": "sha256:781f16c1585a11edae6b7da21a9fb3462dcfec8b8be94caa460afe2fa370408d",
        "files": [
          {
            "bytes": 3173,
            "lines": 68,
            "path": "Cargo.toml",
            "role": "dependency_manifest",
            "sha256": "sha256:c6b324133f86686762be6df921c5c2130fa1f7d58c5871c528485e47084a545b"
          },
          {
            "bytes": 2256,
            "lines": 57,
            "path": "build.rs",
            "role": "source",
            "sha256": "sha256:81a6e54d8ff00b3d3441efc5adf4124ef4288f0ae90006d83f8ee06d7d78b3ee"
          },
          {
            "bytes": 49938,
            "lines": 1177,
            "path": "src/attach_client.rs",
            "role": "source",
            "sha256": "sha256:287f76666af692719531876af515b1e28569ef1c725826b9f86bf6e123159121"
          },
          {
            "bytes": 157983,
            "lines": 4407,
            "path": "src/audit_handlers.rs",
            "role": "source",
            "sha256": "sha256:7f19586363d0f2a67c454bf50321d2eeee5109ef2a10d922ecdf687676c2ca76"
          },
          {
            "bytes": 55972,
            "lines": 1436,
            "path": "src/auto_ingest.rs",
            "role": "source",
            "sha256": "sha256:0428d0173e48b37b0014db3fbe249e352ef5f5638236dd5ba9b95c42a24556bb"
          },
          {
            "bytes": 5386,
            "lines": 154,
            "path": "src/boot_memory_handlers.rs",
            "role": "source",
            "sha256": "sha256:2c53a9ab865380344b4ac2e5b6431c4a5f867ff152b0cec9bafec7619997e0af"
          },
          {
            "bytes": 60878,
            "lines": 1572,
            "path": "src/candidate_edit.rs",
            "role": "source",
            "sha256": "sha256:2ef30002e7fb2984cdf1c19cbcbd81de97349e1dde29c31196e278b2686dfafc"
          },
          {
            "bytes": 7898,
            "lines": 176,
            "path": "src/cli.rs",
            "role": "source",
            "sha256": "sha256:264f034ddaacb0e712ce89a8be501b6ee34b51759d94cdaa0a1da4ef655a80f5"
          },
          {
            "bytes": 36468,
            "lines": 910,
            "path": "src/cockpit.rs",
            "role": "source",
            "sha256": "sha256:dca6c1e47c18bd0e042a33c317969ae602fa6888a4e6d2ded644a2d7562efef5"
          },
          {
            "bytes": 45520,
            "lines": 1092,
            "path": "src/curation_runner.rs",
            "role": "source",
            "sha256": "sha256:d2261d6c1d1fef1ee53e8252e978d1036f30162f3cd6b5b3be8c625b6bdc5540"
          },
          {
            "bytes": 102304,
            "lines": 2620,
            "path": "src/daemon_handlers.rs",
            "role": "source",
            "sha256": "sha256:cf7458d8b8d42547a4b8c7ee24d998e0eb72d4d21f7192873d0b1028a78a489a"
          },
          {
            "bytes": 77139,
            "lines": 1858,
            "path": "src/delegation_handlers.rs",
            "role": "source",
            "sha256": "sha256:119731c3bc037cd619727a6e15be4d7eca2956d286c9194dd080076dd7a3d2bb"
          },
          {
            "bytes": 15863,
            "lines": 537,
            "path": "src/engine_ops.rs",
            "role": "source",
            "sha256": "sha256:253950a2cb55d2f7e8921cf97736d5086174592c347ea15b770fd008776c6258"
          },
          {
            "bytes": 92301,
            "lines": 2434,
            "path": "src/help_guidance.rs",
            "role": "source",
            "sha256": "sha256:e4fb4be2bca145fbfe44a7d4a2c05eda5fdfd5abf694573e66de9967660d0fe7"
          },
          {
            "bytes": 174691,
            "lines": 4047,
            "path": "src/http_server.rs",
            "role": "source",
            "sha256": "sha256:67d48792c6dd85c962633d02e19902b51ea434f1acf71aee3069605dbfd8d158"
          },
          {
            "bytes": 2813,
            "lines": 117,
            "path": "src/http_types.rs",
            "role": "source",
            "sha256": "sha256:04309e4283ea2129b16575d3b74bd8a669a99189d98546af3c303943dc285314"
          },
          {
            "bytes": 35355,
            "lines": 841,
            "path": "src/human_view.rs",
            "role": "source",
            "sha256": "sha256:8137f3ed886d486d8f844a35c7cd076e05ccc35e66d5a115d3093a20bd174b83"
          },
          {
            "bytes": 61722,
            "lines": 1523,
            "path": "src/instance_registry.rs",
            "role": "source",
            "sha256": "sha256:da5639132657badea298793d225d5127e4df8a8e999e9c5030ce22f54dd07cd0"
          },
          {
            "bytes": 551469,
            "lines": 14940,
            "path": "src/layer_handlers.rs",
            "role": "source",
            "sha256": "sha256:890a6a0c5ad1a679921f6ae38700270a20348a440d561ae9d11c5358eddb8fec"
          },
          {
            "bytes": 3166,
            "lines": 87,
            "path": "src/lib.rs",
            "role": "source",
            "sha256": "sha256:c85963599382048b2d1ae0e3e56430157d9135340a7e52e972efdc46219570b1"
          },
          {
            "bytes": 84981,
            "lines": 1960,
            "path": "src/light_author_handlers.rs",
            "role": "source",
            "sha256": "sha256:0ea94ddf9c1997039ae65357d65f5abf3717ac5eb1d2c1d8ffb204ab9fb3b411"
          },
          {
            "bytes": 24502,
            "lines": 739,
            "path": "src/lock_handlers.rs",
            "role": "source",
            "sha256": "sha256:363865e17cffc96fb6730da5fea18e35bc0e949cd064891c75a820f120380a24"
          },
          {
            "bytes": 87973,
            "lines": 2100,
            "path": "src/mailbox.rs",
            "role": "source",
            "sha256": "sha256:b47a049a0e7e84fe9d3c5896945fae4facce4b4709cd7d91d05192040763036c"
          },
          {
            "bytes": 36439,
            "lines": 897,
            "path": "src/main.rs",
            "role": "source",
            "sha256": "sha256:3408bb3aee176bdd01e06b6830bd5a39aa4455609aa3c83f7153c59d5e747594"
          },
          {
            "bytes": 97774,
            "lines": 2337,
            "path": "src/mcp_http.rs",
            "role": "source",
            "sha256": "sha256:4fe5246719ef8e821d5a3e2385900a7d2cf7b89db71951db24b51f5137ee7d7b"
          },
          {
            "bytes": 72060,
            "lines": 1695,
            "path": "src/medulla_migration.rs",
            "role": "source",
            "sha256": "sha256:f6fca78808656b4d8d925412c40059899e086902a6629e34228ee297ceaf3034"
          },
          {
            "bytes": 65310,
            "lines": 1833,
            "path": "src/mission_handlers.rs",
            "role": "source",
            "sha256": "sha256:d5cbd2aa0736974fc05a400d2f064d3b325616b759e13fd522291fbc3d3fa02e"
          },
          {
            "bytes": 56631,
            "lines": 1366,
            "path": "src/mission_letter.rs",
            "role": "source",
            "sha256": "sha256:bd7119a69a49acae5ec43b61b17ffb32252e24cfdce2f51bbcf6edfff9279aa9"
          },
          {
            "bytes": 11525,
            "lines": 204,
            "path": "src/mission_letter_handlers.rs",
            "role": "source",
            "sha256": "sha256:151cab5bb82448f4566f098bc5c1b2a033fb82a36737f2a4bf5d0dd7eabc3a00"
          },
          {
            "bytes": 7627,
            "lines": 192,
            "path": "src/mission_local.rs",
            "role": "source",
            "sha256": "sha256:17b7ebc65bcfda19e8f51cea540783a55933cb80219e053bd5c0dddb35951df9"
          },
          {
            "bytes": 54154,
            "lines": 1228,
            "path": "src/naming_runner.rs",
            "role": "source",
            "sha256": "sha256:652f3004afbd041aeada4ae1fee841342c2aa213edcccb64ec53f4525a15e966"
          },
          {
            "bytes": 3772,
            "lines": 104,
            "path": "src/persist_handlers.rs",
            "role": "source",
            "sha256": "sha256:c0b5797881e3eac5e6f9899bd19ebbc6536f3d859df4490d27fc695d4649d5c0"
          },
          {
            "bytes": 116928,
            "lines": 2571,
            "path": "src/personality.rs",
            "role": "source",
            "sha256": "sha256:035bb7b4f368629573a63f33d0858934e46232d8a7d52ca65edc4401c13adf5a"
          },
          {
            "bytes": 9542,
            "lines": 283,
            "path": "src/perspective/confidence.rs",
            "role": "source",
            "sha256": "sha256:ff747255aaaceba115c918ac65e62aafaf119a656c5991d21dc46398cfdced05"
          },
          {
            "bytes": 4100,
            "lines": 117,
            "path": "src/perspective/keys.rs",
            "role": "source",
            "sha256": "sha256:5cd0fee526012ef8438ee0c4a2860089353d98a7c47558af9d37c89e93d919df"
          },
          {
            "bytes": 636,
            "lines": 16,
            "path": "src/perspective/mod.rs",
            "role": "source",
            "sha256": "sha256:d61c52e3286a521b84adab82cfdac2d332bc8f56a9cd90c1548415f4127fc86c"
          },
          {
            "bytes": 9561,